<?xml version="1.0" encoding="UTF-8"?>
<!DOCTYPE language SYSTEM "language.dtd">
<language name="C" version="1.19" kateversion="2.4" section="Sources" extensions="*.c;*.C;*.h" mimetype="text/x-csrc;text/x-c++src;text/x-chdr" priority="5">
  <highlighting>
    <list name="keywords">
      <item> break </item>
      <item> case </item>
      <item> continue </item>
      <item> default </item>
      <item> do </item>
      <item> else </item>
      <item> enum </item>
      <item> extern </item>
      <item> for </item>
      <item> goto </item>
      <item> if </item>
      <item> inline </item>
      <item> return </item>
      <item> sizeof </item>
      <item> struct </item>
      <item> switch </item>
      <item> typedef </item>
      <item> union </item>
      <item> while </item>
    </list>
    <list name="types">
      <item> auto </item>
      <item> char </item>
      <item> const </item>
      <item> double </item>
      <item> float </item>
      <item> int </item>
      <item> long </item>
      <item> register </item>
      <item> restrict </item>
      <item> short </item>
      <item> signed </item>
      <item> static </item>
      <item> unsigned </item>
      <item> void </item>
      <item> volatile </item>
      <item> _Imaginary </item>
      <item> _Complex </item>
      <item> _Bool </item>
    </list>
    <list name="attention">
      <item> FIXME </item>
      <item> TODO </item>
      <item> ### </item>
    </list>
    <contexts>
      <context attribute="Normal Text" lineEndContext="#stay" name="Normal" skipSpaces="true">
        <RegExpr attribute="Preprocessor" context="Preprocessor" String="#" firstNonSpace="true" />
        <keyword attribute="Keyword" context="#stay" String="keywords"/>
        <keyword attribute="Data Type" context="#stay" String="types"/>
        <DetectChar attribute="Symbol" context="#stay" char="{" beginRegion="Brace1" />
        <DetectChar attribute="Symbol" context="#stay" char="}" endRegion="Brace1" />
        <Float attribute="Float" context="#stay">
          <AnyChar String="fF" attribute="Float" context="#stay"/>
        </Float>
        <HlCOct attribute="Octal" context="#stay"/>
        <HlCHex attribute="Hex" context="#stay"/>
        <Int attribute="Decimal" context="#stay" >
          <StringDetect attribute="Decimal" context="#stay" String="ULL" insensitive="TRUE"/>
          <StringDetect attribute="Decimal" context="#stay" String="LUL" insensitive="TRUE"/>
          <StringDetect attribute="Decimal" context="#stay" String="LLU" insensitive="TRUE"/>
          <StringDetect attribute="Decimal" context="#stay" String="UL" insensitive="TRUE"/>
          <StringDetect attribute="Decimal" context="#stay" String="LU" insensitive="TRUE"/>
          <StringDetect attribute="Decimal" context="#stay" String="LL" insensitive="TRUE"/>
          <StringDetect attribute="Decimal" context="#stay" String="U" insensitive="TRUE"/>
          <StringDetect attribute="Decimal" context="#stay" String="L" insensitive="TRUE"/>
        </Int>
        <HlCChar attribute="Char" context="#stay"/>
        <DetectChar attribute="String" context="String" char="&quot;"/>
        <IncludeRules context="##Doxygen" />
        <Detect2Chars attribute="Comment" context="Commentar 1" char="/" char1="/"/>
        <Detect2Chars attribute="Comment" context="Commentar 2" char="/" char1="*" beginRegion="Comment"/>
        <RegExpr attribute="Preprocessor" context="Outscoped" String="#\s*if\s+0" beginRegion="Outscoped" firstNonSpace="true" />
        <RegExpr attribute="Function" context="#stay" String="\b[_\w][_\w\d]*(?=[\s]*[(])" />
        <RegExpr attribute="Symbol" context="Member" String="[.]{1,1}" />
        <AnyChar attribute="Symbol" context="#stay" String=":!%&amp;()+,-/.*&lt;=&gt;?[]|~^&#59;"/>
      </context>
      <context attribute="String" lineEndContext="#pop" name="String">
        <LineContinue attribute="String" context="#stay"/>
        <HlCStringChar attribute="String Char" context="#stay"/>
        <DetectChar attribute="String" context="#pop" char="&quot;"/>
      </context>
      <context attribute="Normal Text" lineEndContext="#pop" name="Member" fallthrough="true" fallthroughContext="#pop">
        <RegExpr attribute="Function" context="#pop" String="\b[_\w][_\w\d]*(?=[\s]*)" />
      </context>
      <context attribute="Comment" lineEndContext="#pop" name="Commentar 1">
        <keyword attribute="Alert" context="#stay" String="attention" />
      </context>
      <context attribute="Comment" lineEndContext="#stay" name="Commentar 2">
        <Detect2Chars attribute="Comment" context="#pop" char="*" char1="/" endRegion="Comment"/>
        <keyword attribute="Alert" context="#stay" String="attention" />
      </context>
      <context attribute="Preprocessor" lineEndContext="#pop" name="Preprocessor">
        <LineContinue attribute="Preprocessor" context="#stay"/>
        <RegExpr attribute="Preprocessor" context="Define" String="define.*((?=\\))"/>
        <RegExpr attribute="Preprocessor" context="#stay" String="define.*"/>
        <RangeDetect attribute="Prep. Lib" context="#stay" char="&quot;" char1="&quot;"/>
        <RangeDetect attribute="Prep. Lib" context="#stay" char="&lt;" char1="&gt;"/>
        <IncludeRules context="##Doxygen" />
        <Detect2Chars attribute="Comment" context="Commentar/Preprocessor" char="/" char1="*" beginRegion="Comment2"/>
      </context>
      <context attribute="Preprocessor" lineEndContext="#pop" name="Define">
        <LineContinue attribute="Preprocessor" context="#stay"/>
      </context>
      <context attribute="Comment" lineEndContext="#stay" name="Commentar/Preprocessor">
        <Detect2Chars attribute="Comment" context="#pop" char="*" char1="/" endRegion="Comment2" />
      </context>
      <context attribute="Comment" lineEndContext="#stay" name="Outscoped" >
        <Detect2Chars attribute="Comment" context="Commentar 2" char="/" char1="*" beginRegion="Comment"/>
        <keyword attribute="Alert" context="#stay" String="attention" />
        <RegExpr attribute="Comment" context="Outscoped intern" String="#\s*if" beginRegion="Outscoped" firstNonSpace="true" />
        <RegExpr attribute="Preprocessor" context="#pop" String="#\s*(endif|else|elif)" endRegion="Outscoped" firstNonSpace="true" />
      </context>
      <context attribute="Comment" lineEndContext="#stay" name="Outscoped intern">
        <Detect2Chars attribute="Comment" context="Commentar 2" char="/" char1="*" beginRegion="Comment"/>
        <RegExpr attribute="Comment" context="Outscoped intern" String="#\s*if" beginRegion="Outscoped" firstNonSpace="true" />
        <RegExpr attribute="Comment" context="#pop" String="#\s*endif" endRegion="Outscoped" firstNonSpace="true" />
      </context>
    </contexts>
    <itemDatas>
      <itemData name="Normal Text"  defStyleNum="dsNormal"/>
      <itemData name="Keyword"      defStyleNum="dsKeyword"/>
      <itemData name="Function"     defStyleNum="dsFunction" bold="0"/>
      <itemData name="Data Type"    defStyleNum="dsDataType"/>
      <itemData name="Decimal"      defStyleNum="dsDecVal"/>
      <itemData name="Octal"        defStyleNum="dsBaseN"/>
      <itemData name="Hex"          defStyleNum="dsBaseN"/>
      <itemData name="Float"        defStyleNum="dsFloat"/>
      <itemData name="Char"         defStyleNum="dsChar"/>
      <itemData name="String"       defStyleNum="dsString"/>
      <itemData name="String Char"  defStyleNum="dsChar"/>
      <itemData name="Comment"      defStyleNum="dsComment"/>
      <itemData name="Symbol"       defStyleNum="dsNormal"/>
      <itemData name="Preprocessor" defStyleNum="dsOthers"/>
      <itemData name="Prep. Lib"    defStyleNum="dsOthers"/> <!--,Qt::darkYellow,Qt::yellow,false,false)); -->
      <itemData name="Alert"        defStyleNum="dsAlert" />
    </itemDatas>
  </highlighting>
  <general>
    <comments>
      <comment name="singleLine" start="//" />
      <comment name="multiLine" start="/*" end="*/" />
    </comments>
    <keywords casesensitive="1" />
  </general>
</language>
